project,developer,stage,expected_launch,planned_units,indicative_price_psf,signal
Prestige Bagaluru Towers,Prestige,Coming Soon,2026-Q3,680,9500,"Teaser ads live; pre-launch at ~₹9,500/sqft"
Sobha Dream Gardens North,Sobha,Pre-Launch,2026-Q4,410,9800,RERA approved; inventory soft-booking
Godrej Next Plot,Godrej,Announced,2027-Q1,520,10000,Land bank adjacent Ananda III
Purva Eco Extension,Puravankara,Coming Soon,2026-Q2,300,7800,Extension of Ecopolitan catchment
Brigade Aerospace Habitats,Brigade,Teaser,2027-Q2,450,11000,Highway-facing mid-luxury tower
